"5","Отличный аппарат за хорошую цену. Простая, как бревно. Кофе варит быстро. За один раз можно сварить около трех больших кружек."
"5","Замечательная кофеварка в своей ценовой категории!Просто и удобно использовать.Рекомендую!!!"
"4","Оптимальный вариант для небольшой семьи."
"5","Отличный товар.:)"
"5","Компактная ,быстрая и красивая кофеварка.Отлично вписалась в мой интерьер на кухне.Сервис отличный,быстро связались со мной ,доставили через день.Все понравилось. Моя распаковка"
"5","Прочитавши всі коментарі, замовила 2 кавоварки: для себе і для подруги. Нам сподобалось. Напій не поганий, якщо кава гарної якості. Я не люблю окріп в чашці, тому температура кави мене цілком влаштовує. Якщо хочеться погарячіше, то, в крайньому випадку, можна на хвилинку в СВЧ ))) 500 мл напою готується хвилин 5-6, а 200 мл, то хвилин 3. Це теж влаштовує. Гарненька )) Не займає багато місця. Підігрів - знову ж таки гарна функція =) Дякую Розетці за швидку доставку."
"4","Неплохо, за такие деньги неплохой аппарат."
"2","До этого экземпляра пользовалась кофеваркой Мулинекс ( из бюджжетной серии). На объем воды 150-200 мл сыпала кофе 2 чайные ложки с горкой небольшой. И выходил отличный кофе вкусный и достаточно крепкий. Приготовление занимало 5-10 минут. В этой же кофеварке вода перетекла за 1-2 минуты ну и соответственно кофе элементарно не успевает приготовиться . В колбу вылилась слегка подкрашенная жидкость по цвету травяного чая и по вкусу просто отвратительная,будто вы моете чашку после кофе. Что бы приготовить более менее нормальный кофе нужно варить чашечку из 4-5 ложек кофе."
"4","А можно отдельно ёмкость купить?)"
"5","За свою цену отличная кофеварка, по сравнению с гейзерной отличия вкуса есть, но для офиса неплохо."
"5","Не смотря на свою малогабаритность на первый взгляд, варит кофе на две большие чашки кофе. Посмотрим,сколько прослужит. Когда читала инструкцию, испугалась,что она не самовыключается. Но оказалось, что если её не выключить, то кофеварка просто остается в режиме подогрева кофе, что очень порадовало, если вдруг будешь чем-то занят уже холодный кофе пить не придётся)) Кофеваркой довольна."
"4","Кофе варит не хуже Максвела за 900 грн)"
"4","А если после приготовления кофе когда заканчивается вода в резервуаре не выключать кофеварку что б диск подогревал кофе в колбе. там ничего не перегорит??"
"5","за малые деньги - отличный товар!"
"5","Все працює кава смачна)"
"4","ОсобенностиНапряжение/частота: 220 В/50 Гц Очень интересно!"
"5","чудова річ за приємну ціну. компактна та гарно працює. живемо вдвох, об""єм заварника цілком влаштовує.не бачу причин нарікати на щось. чудове співвідношення ціна-якість"
"4","Здравствуйте, купил такую кофеварку более полугода назад. Всей семье она очень понравилась, работает прекрасно, варит кофе быстро. Правда сейчас столкнулись с проблемой, треснула чаша (емкость с готовым кофе). Подскажите, можно ли купить отдельно чашу или служба этой кофеварки уже законченна?"
"4","Кофеварка отличная за такую цену, готовит быстро и вкусно. Спасибо за оперативность."
"5","Всё устраивает."
"5","А сколько мл можно сделать кофе за раз?"
"5","Вкусный кофе. Пользуемся 1 месяц, завариваем кофе 2-3 раза на день, никаких нариканий нет."
"5","В коментарях читав що смак не такий як в турці, розхід кави великий. Я спочатку залив воду із кружки , в якій готую каву, в резервуар кавоварки, щоб зрозуміти скільки потрібно води заливати , потім висипав одну мірну ложку свіжо-змеленої кави у кавоварку. Колбу не підставляю під клапан , а чекаю поки вся необхідна вода випарується. Тоді відключаю кавоварку і підставляю колбу і отримую міцну , смачну і гарячу каву . Паперові фільтри таки треба буде докупити тоді відпаде потреба кожного разу мити багаторазовий фільтер."
"5","все влаштовує, претензій до кави не маю"
"5","за такие деньги то что нужно. доволен."
"5","Хорошая кофеварка"
"5","Очень удобная в использовании, а самое главное, если забыл что заваривается кофе, она сама отключается и снизу работает подогрев. Так что в любое время всегда горячий кофе. Это один из плюсов кофеварки."
"5","Чудово. Вибирала на подарунок чоловіку. Нам сподобалось. Кава швидко робиться, підігрів є. Ми задоволені!"
"5","Кофеваркой очень довольна, пользуемся уже месяц. Все нравится. Простота в эксплуатации, много места не занимает. Нравится стеклянная чаша, объема которой для двоих хватает с головой, при этом используем только половину. Ах, да, и время приготовления кофе - быстро, и на вкусе кофе никак не отражается, получается очень вкусный. Детали легко промывать под проточной водой."
"4","доволен, каждый день пользуемся, жене нравится..."
"5","Кофеварка хорошая, в комплекте многоразовый фильтр, мерная ложечка, инструкция и гарантийный талон. Неприятного запаха нет. За такую цену очень хороший вариант"
"5","Подарили мне на день рождение, как самому большому кофеману. Теперь тащусь каждое утро. купила даже хорошое итальянское кофе, специально для нее. Очень довольна подарком. Работает быстро, расход кофе относительно не вилик. Но сразу подставлять чайник не надо. нужно что б в чашке настоялася кофе, и тогда уже спускать"
"5","Це в мене перша кавоварка, на авторитетного критика не претендую, але кава получається на порядок смачнішою ніж просто залити кип’ятком в кружці."
"5","Кофеварка суперская на свою цену)))"
"5","для двоих в самый раз!!спасибо!"
"5","Хорошая кофеварка. Пользуюсь уже несколько недель. Доволен. Кофе готовит быстро. Нет никакого неприятного запаха. Объём устраивает полностью."
"4","Прикольная кофеварка, для бюджетного варианта - отлично. Места почти не занимает, кофе делает, подогревает уже готовый, все это за маленькие деньги. Что еще нужно?"
"5","Сегодня получила спасибо,кофеварка как раз супер,не чего лишнего, компактная и простая в использовании,кто то писал,что шнур короткий не чего поточного у нас в электропиле гораздо короче)вообщем берите не прогодаете и цена вобще мизер."
"4","Пользуемся активно пол года.Посоветовала родственникам,купили у Вас еще две такие же.Никто не разочаровался) За такую цену - отличная кофеварка."
"5","Очень хорошая на свою цену кофеварка. Простая в использование. Недостатков не нешел)."
"5","Пользуюсь кофеваркой уже 9 мес на день по несколько раз. Работает отлично. Не сильно шумная и быстро варит кофе (при этом крепость напитка не страдает). Рекомендую как в дом, так и в офис)"
"5","отличная кофеварка"
"5","Очень рады покупки."
"4","рекомендую из-за простоты использования.Эта характеристика перекрывает любые(надуманные) недостатки"
"5","Распаковка и комплектация: https://youtu.be/zkK7ikVC9WE Хорошая и простая кофеварка, ничего в ней лишнего нет, кофе заваривается очень быстро...около 5-7 минут. Удобно и то, что в ней есть подогрев, то есть после приготовления кофе не остывает. Еще, её плюс заключается в компактности - на маленькой кухне особенно ценишь свободное пространство, а этой маленькой кофеварочке можно найти место хоть на столе, хоть на холодильнике. Объем приготовленного кофе составляет 500 мл, этого хватает примерно на две большие чашки, или на 3, 4 или 5 небольших чашечек."
"5","маленькая, удобная, правда немного шумит во время работы, хватает на чашки три, цена доступная. Советую"
"5","Замечательная кофеварка, быстро, просто, никаких заморочек. Приятная цена. Самое то для утреннего кофе!"
"4","Пользуюсь месяц, хорошая кофеварка"
"3","сегодня получила заказанную кофеварку,начиталась положительных отзывов и остановила свой выбор именно на ней.Конечно,за такую цену не стоит ожидать многого.Варит кофе быстро,уж очень быстро,поэтому кофе ненасыщенного вкуса.Корпус с очень слабенько пластмассы,приходится делать всё очень остороожно.."
"5","Отличная кофеварка!!!! Покупали год назад пользуемся по сей день и все супер. Чаши хватает на две полные обычные чашки."
"4","Кофеварка стоит этих денег. Варит не плохо. Нам хватает. Правда немного хлипкая."
"5","Для такой цены очень хорошая кофеварка. Варит кофе вкусно. Выглядит очень симпатично, много места не занимает. В использовании простая - налил воды, засыпал кофе, нажал кнопку - получил кофе. Готовый кофе сливается не сразу в чашку, а в стеклянный кувшинчик. Чтобы кофе в нем не остывало, нужно просто не выключать кофеварку после приготовления кофе, и тогда платформа под кувшинчиком будет его подогревать. Очень удобно. В общем, советую всем кофеманам. Тут некоторые жаловались на большой расход кофе. На одну чашку я насыпаю одну чайную ложку молотого кофе с горкой. Кофе получается отличный, насыщенный. При приготовлении в турке уходит столько же кофе. Поэтому сказать, что кофеварка использует очень много кофе, не могу."
"5","Соотношение цена качество - отлично! Для бытовой кофеварки пойдет на первое время"
"5","Отличная кофеварка. Есть в комплекте многоразовый фильтр, быстро варит, подогревает кофе после его варки и к этому всему цена приятная. Для 2-3 человек в семье ее хватает более чем. Я всем доволен."
"4","видео распаковки здесь: https://youtu.be/JYusWPctcrY"
"5","https://youtu.be/Pww7qqNKGao"
"5","Жду сообщений об акциях на многоразовый фильтр"
"5","довольна очень хорошая за такую цену"
"4","За такую цену, можно купить попробовать, что и как, так как у всех разные вкусы и мнения."
"4","всё понравилось!"
"5","Отличный аппарат за хорошую цену. Простая, как бревно. Кофе варит быстро. За один раз можно сварить около трех больших кружек."
"4","товар не разочаровал"
"5","Подробнее: http://bt.rozetka.com.ua/magio-mg-344/p301161/comments/#comment_form"
"3","Я не знаю зачем было делать фильтр размером с резервуар для воды. Купил этот прибор, решил сделать себе чашечку кофе. В среднем, для кофе в турке уходит столовая ложка кофе на чашку. Ну я и кинул столовую ложку кофе в фильтр, на выходе получил ярко желтую жидкость. Что бы добиться нормального цвета напитка, пришлось вкинуть в фильтр ТРЫ столовые ложки с горкой молотого кофе! Если вы покупаете зерна хорошего дорогого кофе, обратите внимание на кофеварки подороже, не делайте моих ошибок."
"5","Для такой цены результат великолепный, даже не ожидала когда покупала"
"5","кофе вкусный! цена отличная"
